Title,Short URL,Date Posted,Post ID
Humanity May Be Alone In The Universe,https://tmblr.co/ZuSL8t2RznB9C,2017-11-13,167466283596
How One Ambitious Veteran Launched An Instagram Empire From Afghanistan,https://tmblr.co/ZuSL8t2RzZiFB,2017-11-13,167462749131
Should You Pay in Local Or Home Currency When Traveling?,https://tmblr.co/ZuSL8t2RzLT6D,2017-11-13,167459017101
Study: Whopping 93% Say They're More Productive Working Remotely,https://tmblr.co/ZuSL8t2Rz7z-i,2017-11-13,167455481836
Coping In A Toxic Work Environment,https://tmblr.co/ZuSL8t2RyxfZn,2017-11-13,167452252401
Where Educated Millennials Are Moving,https://tmblr.co/ZuSL8t2RymbLD,2017-11-13,167449351501
6 Strategies That Science Actually Shows Are Effective For Depression,https://tmblr.co/ZuSL8t2RydBX2,2017-11-13,167446886466
Warming Up The Cold Outreach: How To Email A Stranger,https://tmblr.co/ZuSL8t2RyVZ6r,2017-11-13,167444885941
Ace Your Next Interview With These 4 Subtle Tricks,https://tmblr.co/ZuSL8t2RyNTWR,2017-11-13,167442765851
10 Harsh Things You Need To Hear Right Now,https://tmblr.co/ZuSL8t2RyCoCj,2017-11-13,167439967021
7 Ways Meditation Can Actually Change The Brain,https://tmblr.co/ZuSL8t2Rx-67V,2017-11-13,167436378591
9 TED Talks That Will Inspire You To Quit Your Job And Travel For A Career,https://tmblr.co/ZuSL8t2Rxmi5L,2017-11-13,167432601941
5 Ways To Make Your Home Office Better,https://tmblr.co/ZuSL8t2RxYtFG,2017-11-12,167428977616
Want A Raise Or Promotion? Follow These 3 Steps,https://tmblr.co/ZuSL8t2RxJzUe,2017-11-12,167425071016
Are These The 20 Most Beautiful Places in the World?,https://tmblr.co/ZuSL8t2Rx4hDQ,2017-11-12,167421064026
The Death Of Brand Loyalty: Cultural Shifts Mean It's Gone Forever,https://tmblr.co/ZuSL8t2Rws10Q,2017-11-12,167417221146
"Millennials, Stop Apologizing For Job-Hopping",https://tmblr.co/ZuSL8t2RweCMc,2017-11-12,167413597606
3 Ways The Natural Parenting Movement Dehumanizes Women,https://tmblr.co/ZuSL8t2RwRr1m,2017-11-12,167410356336
Why Doesn't The United States Have High-Speed Bullet Trains Like Europe And Asia?,https://tmblr.co/ZuSL8t2RwIRZY,2017-11-12,167407892706
7 Tips For Millennials Entering The Real World,https://tmblr.co/ZuSL8t2RwAVu8,2017-11-12,167405813256
20 Reasons Not To Give Up,https://tmblr.co/ZuSL8t2Rw1Z4D,2017-11-12,167403467021
Five Top Resume Turnoffs,https://tmblr.co/ZuSL8t2Rvsm6u,2017-11-12,167400636856
"Sweat Equity: Inside The Daily Fitness Routines Of Branson, Zuckerberg And Other Time-Starved Founders And CEOs",https://tmblr.co/ZuSL8t2Rvginu,2017-11-12,167397477496
The Best Places To Retire Without A Car,https://tmblr.co/ZuSL8t2RvU2wP,2017-11-12,167394160281
How To Blow $9 Billion: The Fallen Stroh Family,https://tmblr.co/ZuSL8t2RvGzJS,2017-11-11,167390729436
The Best Advice 11 Inspiring Women In Tech Would Give To Their College Selves,https://tmblr.co/ZuSL8t2Rv3Kz8,2017-11-11,167387156296
5 Reasons Why Non-Digital Time Management Is More Productive,https://tmblr.co/ZuSL8t2RurkZ2,2017-11-11,167383591106
"37 Ways To Game The Airlines: How To Get Free Flights, Travel Perks And More",https://tmblr.co/ZuSL8t2RuedLW,2017-11-11,167380153696
10 Overlooked Places In Your Living Room To Create More Space,https://tmblr.co/ZuSL8t2RuRyZR,2017-11-11,167376832731
This Entrepreneur Started A Travel Company That Can Help You Quit Your Job,https://tmblr.co/ZuSL8t2RuGjRr,2017-11-11,167373887221
Work-Life Checks And Balances,https://tmblr.co/ZuSL8t2Ru7qvH,2017-11-11,167371558481
These Are The Highest Paying Jobs In The Gig Economy,https://tmblr.co/ZuSL8t2Ru0Ggp,2017-11-11,167369575091
7 Ways To Get Ready For Retirement If You're 50 And Haven't Started Saving,https://tmblr.co/ZuSL8t2Rtu7Yi,2017-11-11,167367440556
Workers In These Jobs Get The Most Sleep,https://tmblr.co/ZuSL8t2RtkOqj,2017-11-11,167364889901
5 Things Successful Parents Know About Kids And Money,https://tmblr.co/ZuSL8t2RtYvtD,2017-11-11,167361879501
4 Ways To Be More Confident At Work,https://tmblr.co/ZuSL8t2RtMuo7,2017-11-11,167358729351
Things You Should And Should Not Do After You Apply For Your Mortgage,https://tmblr.co/ZuSL8t2RtAb6P,2017-11-10,167355503001
Full List: Where To Invest In Housing In 2017,https://tmblr.co/ZuSL8t2Rsz04q,2017-11-10,167351943476
Three Steps To Improving Your Life And Finding Your Purpose,https://tmblr.co/ZuSL8t2Rsl_HJ,2017-11-10,167348528211
Stay At Home Mom Vs. Returning To Work: A Cost Analysis,https://tmblr.co/ZuSL8t2RsZJJ_,2017-11-10,167345206526
The World's Largest Condominium Yacht,https://tmblr.co/ZuSL8t2RsN9gN,2017-11-10,167342021271
How To Fire An Employee When All Else Fails,https://tmblr.co/ZuSL8t2RsCNB2,2017-11-10,167339193026
The Real Cost of Your Shopping Habits,https://tmblr.co/ZuSL8t2Rs3bNu,2017-11-10,167336891896
"Day In The Life: What It's Like To Be A Female Pilot At 40,000 Feet",https://tmblr.co/ZuSL8t2RryoAS,2017-11-10,167335109276
The Five Most Expensive Cities In The World,https://tmblr.co/ZuSL8t2RrrM_V,2017-11-10,167333162911
How One Digital Marketer's Inspiring Story Amassed 1.7M Followers,https://tmblr.co/ZuSL8t2Rrh5Xn,2017-11-10,167330470001
What If Superhero Movies Actually Followed The Laws Of Physics?,https://tmblr.co/ZuSL8t2RrUGwj,2017-11-10,167327108781
Q+A With The First Female Director Of MIT's Largest Research Lab,https://tmblr.co/ZuSL8t2RrGgiL,2017-11-10,167323544341
"Why Your Kids Should Take Out Student Loans, Even If You Can Afford To Pay For College",https://tmblr.co/ZuSL8t2Rr3T5W,2017-11-09,167320080736
How Lead Caused America's Violent Crime Epidemic,https://tmblr.co/ZuSL8t2RqrhBK,2017-11-09,167316468436
